[
  {
    "id": "SERGE_001",
    "name": "Artefatti di bassa qualità",
    "description": "Gli artefatti prodotti necessitano di ulteriori revisioni e lavoro, con rischio di ritardi e bug.",
    "category": "process",
    "probability": 4,
    "impact": 3,
    "prevention": "Formazione tecnica aggiuntiva",
    "contingency": "Definizione di standard di qualità",
    "severity": "Medium"
  },
  {
    "id": "SERGE_002",
    "name": "Requisiti instabili",
    "description": "I requisiti del progetto cambiano frequentemente durante gli sprint.",
    "category": "requirements",
    "probability": 3,
    "impact": 5,
    "prevention": "Sessioni di backlog grooming frequenti",
    "contingency": "Coinvolgimento costante dello stakeholder",
    "severity": "High"
  },
  {
    "id": "SERGE_003",
    "name": "Scarso coinvolgimento dello stakeholder",
    "description": "Lo stakeholder principale non partecipa regolarmente alle review, causando decisioni ritardate.",
    "category": "organizational",
    "probability": 3,
    "impact": 1,
    "prevention": "Stabilire incontri obbligatori",
    "contingency": "Nomina di un proxy decisionale",
    "severity": "Low"
  },
  {
    "id": "SERGE_004",
    "name": "Latenza imprevista in cloud",
    "description": "Architettura non ottimizzata per distribuzione geografica.",
    "category": "technology",
    "probability": 2,
    "impact": 3,
    "prevention": "CDN e edge",
    "contingency": "Profilazione prestazioni",
    "severity": "Low"
  },
  {
    "id": "SERGE_005",
    "name": "Dipendenza da un fornitore esterno",
    "description": "Un componente critico dipende da un fornitore con SLA poco chiari.",
    "category": "organizational",
    "probability": 3,
    "impact": 1,
    "prevention": "Definire SLA contrattuali",
    "contingency": "Piano B tecnico",
    "severity": "Low"
  },
  {
    "id": "SERGE_006",
    "name": "Debito tecnico accumulato",
    "description": "Attività di refactoring rinviate compromettono la manutenibilità del sistema.",
    "category": "process",
    "probability": 2,
    "impact": 5,
    "prevention": "Refactoring time-boxed",
    "contingency": "Definition of Done aggiornata",
    "severity": "Medium"
  },
  {
    "id": "SERGE_007",
    "name": "Stime eccessivamente ottimistiche",
    "description": "Il team sovrastima la propria capacità di consegna.",
    "category": "process",
    "probability": 2,
    "impact": 1,
    "prevention": "Usare dati storici",
    "contingency": "Planning poker con intervalli di confidenza",
    "severity": "Low"
  },
  {
    "id": "SERGE_008",
    "name": "Documentazione scarsa",
    "description": "La mancanza di documentazione rende difficile il passaggio di conoscenze.",
    "category": "process",
    "probability": 4,
    "impact": 5,
    "prevention": "Docs-as-code",
    "contingency": "Standardizzazione documentale",
    "severity": "High"
  },
  {
    "id": "SERGE_009",
    "name": "Ambiente di test instabile",
    "description": "Gli ambienti di test non sono affidabili, generando falsi negativi e positivi.",
    "category": "technology",
    "probability": 3,
    "impact": 1,
    "prevention": "Infrastructure as Code",
    "contingency": "Test di smoke automatici",
    "severity": "Low"
  },
  {
    "id": "SERGE_010",
    "name": "Carenza di competenze tecnologiche",
    "description": "Il team non ha esperienza sufficiente con il nuovo framework adottato.",
    "category": "process",
    "probability": 4,
    "impact": 5,
    "prevention": "Formazione mirata",
    "contingency": "Affiancamento con esperti",
    "severity": "High"
  },
  {
    "id": "SERGE_011",
    "name": "Conflitto tra stakeholder",
    "description": "Stakeholder con obiettivi divergenti bloccano le decisioni.",
    "category": "organizational",
    "probability": 4,
    "impact": 5,
    "prevention": "Workshop di allineamento",
    "contingency": "Definizione di criteri di priorità condivisi",
    "severity": "High"
  },
  {
    "id": "SERGE_012",
    "name": "Mancanza di esperienza sul nuovo framework front–end",
    "description": "Il team non ha familiarità con il framework scelto, rallentando la produttività.",
    "category": "technology",
    "probability": 4,
    "impact": 3,
    "prevention": "Analisi TCO",
    "contingency": "Valutare alternative open source",
    "severity": "Medium"
  },
  {
    "id": "SERGE_013",
    "name": "Obsolescenza tecnologica",
    "description": "La toolchain adottata è obsoleta e rallenta i rilasci.",
    "category": "technology",
    "probability": 4,
    "impact": 1,
    "prevention": "Aggiornare CI/CD",
    "contingency": "Automatizzare i test critici",
    "severity": "Low"
  },
  {
    "id": "SERGE_014",
    "name": "Scarsa comunicazione nel team",
    "description": "Informazioni critiche non vengono condivise tempestivamente.",
    "category": "process",
    "probability": 3,
    "impact": 5,
    "prevention": "Daily meeting efficaci",
    "contingency": "Utilizzo di strumenti collaborativi",
    "severity": "High"
  },
  {
    "id": "SERGE_015",
    "name": "Resistenza al cambiamento",
    "description": "Il team rifiuta l’adozione di nuove pratiche come le code review.",
    "category": "process",
    "probability": 4,
    "impact": 5,
    "prevention": "Formazione mirata",
    "contingency": "Pair programming; Prototipazione moduli critici",
    "severity": "High"
  },
  {
    "id": "SERGE_016",
    "name": "Vincoli normativi sottovalutati",
    "description": "Requisiti di conformità (es. GDPR) non analizzati nelle prime fasi.",
    "category": "requirements",
    "probability": 2,
    "impact": 5,
    "prevention": "Coinvolgere compliance early",
    "contingency": "Privacy by design",
    "severity": "Medium"
  },
  {
    "id": "SERGE_017",
    "name": "Stakeholder con aspettative non realistiche",
    "description": "Richieste oltre le reali possibilità di tempo e risorse.",
    "category": "organizational",
    "probability": 3,
    "impact": 5,
    "prevention": "Gestione delle aspettative",
    "contingency": "Contratti chiari",
    "severity": "High"
  },
  {
    "id": "SERGE_018",
    "name": "Team sovraccarico",
    "description": "Il team è impegnato su troppi progetti contemporaneamente.",
    "category": "process",
    "probability": 3,
    "impact": 5,
    "prevention": "Limitare WIP",
    "contingency": "Capacity planning",
    "severity": "High"
  },
  {
    "id": "SERGE_019",
    "name": "Ambiguità nelle acceptance criteria",
    "description": "Criteri di accettazione non misurabili creano confusione nei test.",
    "category": "requirements",
    "probability": 3,
    "impact": 1,
    "prevention": "AC SMART",
    "contingency": "Example mapping",
    "severity": "Low"
  },
  {
    "id": "SERGE_020",
    "name": "Dati di produzione non protetti",
    "description": "Utilizzo improprio di dati reali in ambienti di test.",
    "category": "process",
    "probability": 2,
    "impact": 3,
    "prevention": "Data masking",
    "contingency": "Policy di accesso",
    "severity": "Low"
  },
  {
    "id": "SERGE_021",
    "name": "Mancata definizione delle priorità nel backlog",
    "description": "Le user story nel backlog non hanno priorità chiare, portando a confusione durante la pianificazione e a ritardi nello sviluppo.",
    "category": "process",
    "probability": 3,
    "impact": 3,
    "prevention": "Introdurre un sistema di prioritizzazione",
    "contingency": "Revisione periodica del backlog con gli stakeholder",
    "severity": "Medium"
  },
  {
    "id": "SERGE_022",
    "name": "Cambiamenti frequenti dei requisiti",
    "description": "Lo stakeholder modifica priorità e ambito a metà sprint, causando rielaborazioni e slittamenti.",
    "category": "requirements",
    "probability": 2,
    "impact": 5,
    "prevention": "Change control board",
    "contingency": "Backlog grooming più frequente",
    "severity": "Medium"
  },
  {
    "id": "SERGE_023",
    "name": "Obsolescenza della toolchain CI/CD",
    "description": "Pipeline CI/CD datata causa build instabili e tempi di rilascio imprevedibili.",
    "category": "technology",
    "probability": 2,
    "impact": 5,
    "prevention": "Aggiornare la toolchain",
    "contingency": "Automatizzare i test critici",
    "severity": "Medium"
  },
  {
    "id": "SERGE_024",
    "name": "Sovrastima della velocità del team",
    "description": "La pianificazione assume una velocità non realistica, con conseguenti ritardi sistematici.",
    "category": "process",
    "probability": 4,
    "impact": 1,
    "prevention": "Ricalibrare la velocity",
    "contingency": "Buffer di contingenza",
    "severity": "Low"
  },
  {
    "id": "SERGE_025",
    "name": "Costi imprevisti di licenze",
    "description": "Licenze software non pianificate aumentano i costi.",
    "category": "process",
    "probability": 4,
    "impact": 3,
    "prevention": "Analisi TCO",
    "contingency": "Valutare alternative open source",
    "severity": "Medium"
  },
  {
    "id": "SERGE_026",
    "name": "Stima dei costi incompleta",
    "description": "Costi infrastrutturali e licenze non conteggiati in pianificazione.",
    "category": "process",
    "probability": 2,
    "impact": 1,
    "prevention": "Revisione WBS",
    "contingency": "Analisi TCO",
    "severity": "Low"
  },
  {
    "id": "SERGE_027",
    "name": "Pianificazione senza buffer per test di integrazione",
    "description": "Le release sono pianificate senza margine per test end-to-end, aumentando il rischio di slittamenti.",
    "category": "process",
    "probability": 3,
    "impact": 3,
    "prevention": "Inserimento di buffer",
    "contingency": "Test di regressione automatizzati",
    "severity": "Medium"
  },
  {
    "id": "SERGE_028",
    "name": "Sicurezza non by design",
    "description": "Hardening e threat modeling assenti nelle prime fasi di progetto.",
    "category": "process",
    "probability": 4,
    "impact": 1,